{
  "archive_index": null,
  "build": {
    "built_at": "2026-08-05T15:40:40Z",
    "source_date_epoch": null
  },
  "freshness": {
    "age_seconds": null,
    "last_published_at": null,
    "stale_after_seconds": 21600,
    "state": "unknown",
    "warning_after_seconds": 10800
  },
  "media": {
    "count": 0,
    "latest_id": null,
    "latest_sha256": null,
    "latest_source_path": null
  },
  "profile": "hub",
  "publication": {
    "manifest_generated_at": null
  },
  "repository": "Wirtelprimpf-generator",
  "schema_version": "1.0.0",
  "source_revision": "52ba59a8b15250cf181d052cc542887d58b3b3ca",
  "stories": {
    "chapter_count": 0,
    "count": 0,
    "latest_id": null,
    "latest_timestamp": null,
    "latest_volume": null
  }
}
